A1: BOLIVIA 29 nov - 31 dic 2002 P. Ricceri & M. Salvioni - Switzerland | D1: 1 | E1: 2 | F1: 3 | G1: 4 | H1: 5 | I1: 6 | J1: 7 | K1: 8 | L1: 9 | M1: 10 | N1: 11 | O1: 12 | P1: 13 | Q1: 14 | R1: 15 | S1: 16 | T1: 17
C2: TOT | D2: Samaipata 30.11; 1-2.12; 19-30.12 | E2: Trinidad airport 3.12 | F2: Rurrenabaque & Chalalan 3-7.12 | G2: Siberia forest 8.12 | H2: Mataral Valley 8-9.12 | I2: Incallajta Ruins 10.12 | J2: Cochabamba/ Laguna Alalay 10; 13.12 | K2: Old Chapare road 11-13.12 | L2: Oruru & Lake Poopo 14.12 | M2: Salar de Uyuni 15-16.12 | N2: Potosì 17.12 | O2: Sucre - Comarapa road 18.12 | P2: Comarapa 19.12 | Q2: Laguna Volcan 26.12 | R2: Cuevas waterfalls 26.12 | S2: Amborò N.Pk. - La Yunga 27.12 | T2: Amborò N.Pk. - Las Lauras 28.12
A3: SPECIES ENGLISH | B3: LATIN
A4: Lesser Rhea | B4: Rhea pennata | C4: 1 | N4: 1 | U4: On the road Uyuni - Potosì
A5: Tataupa Tinamou | B5: Crypturellus tataupa | C5: 1 | D5: 1 | H5: 1 | T5: 1
A6: Red-winged Tinamou | B6: Rhynchotus rufescens | C6: ? | D6: ?
A7: Brushland Tinamou | B7: Nothoprocta cinerascens | C7: 1 | I7: 1
A8: Darwin's Nothura | B8: Nothura darwinii | C8: ? | D8: ?
A9: Least Grebe | B9: Tachybaptus dominicus | C9: 1 | F9: 1 | Q9: 1
A10: Pied-billed Grebe | B10: Podilymbus podiceps | C10: 1 | Q10: 1
A11: Silvery Grebe | B11: Podiceps occipitalis | C11: 1 | N11: 1 | U11: Water reservoir at 4'500m!
A12: Neotropic or Olivaceous Cormorant | B12: Phalacrocorax brasilianus | C12: 1 | F12: 1 | J12: 1 | L12: 1 | O12: 1
A13: Anhinga | B13: Anhinga anhinga | C13: 1 | F13: 1
A14: Capped Heron | B14: Pilherodius pileatus | C14: 1 | F14: 1
A15: Cocoi or White-necked Heron | B15: Ardea cocoi | C15: 1 | D15: 1 | F15: 1
A16: Great Egret | B16: Ardea alba | C16: 1 | F16: 1 | J16: 1
A17: Snowy Egret | B17: Egretta thula | C17: 1 | F17: 1 | J17: 1 | L17: 1 | Q17: 1
A18: Cattle Egret | B18: Bubulcus ibis | C18: 1 | F18: 1 | J18: 1
A19: Striated Heron | B19: Butorides striatus | C19: 1 | F19: 1 | Q19: 1
A20: Agami Heron | B20: Agamia agami | C20: 1 | F20: 1
A21: Black-crowned Night-Heron | B21: Nycticorax nycticorax | C21: 1 | J21: 1 | L21: 1
A22: Wood Stork | B22: Mycteria americana | C22: 1 | F22: 1
A23: Puna Ibis | B23: Plegadis ridgwayi | C23: 1 | J23: 1 | L23: 1
A24: Roseate Spoonbill | B24: Ajaia ajaja | C24: 1 | F24: 1
A25: Chilean Flamingo | B25: Phoenicopterus chilensis | C25: 1 | L25: 1
A26: Horned Screamer | B26: Anhima cornuta | C26: 1 | E26: 1 | U26: In flight only
A27: Orinoco Goose | B27: Neochen jubata | C27: 1 | F27: 1
A28: Speckled Teal | B28: Anas flavirostris | C28: 1 | L28: 1 | N28: 1 | O28: 1
A29: Crested Duck | B29: Anas specularioides | C29: 1 | L29: 1
A30: Yellow-billed Pintail | B30: Anas georgica | C30: 1 | J30: 1 | L30: 1
A31: Puna Teal | B31: Anas puna | C31: 1 | J31: 1
A32: Cinnamon Teal | B32: Anas cyanoptera | C32: 1 | J32: 1 | L32: 1
A33: Black Vulture | B33: Coragyps atratus | C33: 1 | D33: 1 | E33: 1 | F33: 1 | O33: 1 | P33: 1 | Q33: 1
A34: Turkey Vulture | B34: Cathartes aura | C34: 1 | D34: 1 | E34: 1 | F34: 1 | G34: 1 | H34: 1 | N34: 1 | O34: 1 | P34: 1 | Q34: 1
A35: Andean Condor | B35: Vultur gryphus | C35: 1 | D35: 1 | H35: 1 | P35: 1
A36: King Vulture | B36: Sarcoramphus papa | C36: 1 | Q36: 1
A37: Osprey | B37: Pandion haliaetus | C37: 1 | F37: 1
A38: Hook-billed Kite | B38: Chondrohierax uncinatus | C38: 1 | K38: ? | S38: 1
A39: Swallow-tailed Kite | B39: Elanoides forficatus | C39: 1 | D39: 1 | G39: 1 | Q39: 1 | R39: 1 | S39: 1 | T39: 1
A40: White-tailed Kite | B40: Elanus leucurus | C40: 1 | P40: 1
A41: Plumbeous Kite | B41: Ictinia plumbea | C41: 1 | F41: 1 | Q41: 1 | R41: 1
A42: Great Black-Hawk | B42: Buteogallus urubitinga | C42: 1 | F42: 1
A43: Black-chested Buzzard-Eagle | B43: Geranoaetus melanoleucus | C43: 1 | L43: 1
A44: Roadside Hawk | B44: Buteo magnirostris | C44: 1 | F44: 1 | P44: 1 | Q44: 1
A45: Broad-winged Hawk | B45: Buteo platypterus | C45: ? | G45: ? | O45: ?
A46: Short-tailed Hawk | B46: Buteo brachyurus | C46: ? | D46: ?
A47: Variable Hawk | B47: Buteo polyosoma | C47: 1 | L47: 1 | U47: ssp or full sp poecilochrous
A48: Black Caracara | B48: Daptrius ater | C48: 1 | F48: 1
A49: Red-throated Caracara | B49: Daptrius americanus | C49: 1 | F49: 1
A50: Mountain Caracara | B50: Phalcoboenus megalopterus | C50: 1 | D50: 1 | G50: 1 | K50: 1 | L50: 1 | M50: 1
A51: Southern caracara | B51: Caracara cherivay | C51: 1 | F51: 1 | H51: 1 | P51: 1
A52: Chimango Caracara | B52: Milvago chimango | C52: 1 | L52: 1
A53: Barred Forest-Falcon | B53: Micrastur ruficollis | C53: ? | T53: ?
A54: American Kestrel | B54: Falco sparverius | C54: 1 | D54: 1 | I54: 1 | K54: 1 | L54: 1 | O54: 1 | P54: 1
A55: Aplomado Falcon | B55: Falco femoralis | C55: 1 | O55: 1
A56: Bat Falcon | B56: Falco rufigularis | C56: 1 | F56: 1
A57: Spix's Guan | B57: Penelope jacquacu | C57: 1 | F57: 1
A58: Blue-throated Piping-Guan | B58: Pipile cumanensis | C58: 1 | F58: 1
A59: Razor-billed Curassow | B59: Mitu tuberosa | C59: 1 | F59: 1
A60: Hoatzin | B60: Opisthocomus hoazin | C60: 1 | F60: 1
A61: Gray-necked Wood-Rail | B61: Aramides cajanea | C61: 1 | R61: 1
A62: Plumbeous Rail | B62: Pardirallus sanguinolentus | C62: 1 | J62: 1
A63: Common Moorhen | B63: Gallinula chloropus | C63: 1 | J63: 1 | Q63: 1
A64: Slate-colored or Andean Coot | B64: Fulica ardesiaca | C64: 1 | J64: 1
A65: Wattled Jacana | B65: Jacana jacana | C65: 1 | E65: 1 | Q65: 1
A66: Black-necked Stilt | B66: Himantopus mexicanus | C66: 1 | J66: 1 | L66: 1
A67: Andean Avocet | B67: Recurvirostra andina | C67: 1 | J67: 1 | L67: 1
A68: Pied Lapwing | B68: Vanellus cayanus | C68: 1 | F68: 1
A69: Southern Lapwing | B69: Vanellus chilensis | C69: 1 | E69: 1 | F69: 1
A70: Andean Lapwing | B70: Vanellus resplendens | C70: 1 | L70: 1 | O70: 1
A71: Collared Plover | B71: Charadrius collaris | C71: 1 | E71: 1 | J71: 1
A72: Puna Plover | B72: Charadrius alticola | C72: 1 | L72: 1
A73: Greater Yellowlegs | B73: Tringa melanoleuca | C73: 1 | J73: 1 | L73: ?
A74: Lesser Yellowlegs | B74: Tringa flavipes | C74: 1 | J74: 1 | L74: ?
A75: Solitary Sandpiper | B75: Tringa solitaria | C75: 1 | D75: 1 | E75: 1 | P75: 1
A76: Spotted Sandpiper | B76: Actitis macularia | C76: 1 | F76: 1 | J76: 1
A77: Baird's Sandpiper | B77: Calidris bairdii | C77: 1 | L77: 1
A78: Wilson's Phalarope | B78: Phalaropus tricolor | C78: 1 | J78: 1
A79: Grey-breasted Seedsnipe | B79: Thinocorus orbignyianus | C79: 1 | N79: 1 | U79: Water reservoir at 4'500m!
A80: Andean Gull | B80: Larus serranus | C80: 1 | J80: 1 | L80: 1
A81: Yellow-billed Tern | B81: Sterna superciliaris | C81: 1 | F81: 1
A82: Large-billed Tern | B82: Phaetusa simplex | C82: 1 | F82: 1
A83: Black Skimmer | B83: Rynchops niger | C83: 1 | F83: 1
A84: Rock Dove | B84: Columba livia | C84: 1 | D84: 1 | E84: 1 | F84: 1 | J84: 1 | O84: 1 | P84: 1
A85: Picazuro Pigeon | B85: Columba picazuro | C85: 1 | N85: 1
A86: Band-tailed Pigeon | B86: Columba fasciata | C86: 1 | D86: 1 | G86: 1 | K86: 1
A87: Plumbeous Pigeon | B87: Columba plumbea | C87: 1 | K87: 1 | U87: 2'300m
A88: Ruddy Pigeon | B88: Columba subvinacea | C88: 1 | F88: 1
A89: Eared Dove | B89: Zenaida auriculata | C89: 1 | D89: 1 | H89: 1 | J89: 1 | O89: 1
A90: Ruddy Ground-Dove | B90: Columbina talpacoti | C90: 1 | E90: 1
A91: Picui Ground-Dove | B91: Columbina picui | C91: 1 | D91: 1 | E91: 1 | H91: 1 | J91: 1 | N91: 1 | O91: 1
A92: Bare-faced Ground-Dove | B92: Metriopelia ceciliae | C92: 1 | I92: 1 | J92: 1 | O92: 1
A93: Black-winged Ground-Dove | B93: Metriopelia melanoptera | C93: 1 | I93: 1 | L93: 1
A94: Golden-spotted Ground-Dove | B94: Metriopelia aymara | C94: 1 | L94: 1 | M94: 1 | N94: 1 | O94: 1
A95: White-tipped Dove | B95: Leptotila verreauxi | C95: 1 | D95: 1 | H95: 1 | T95: 1
A96: Ruddy Quail-Dove | B96: Geotrygon montana | C96: 1 | F96: 1
A97: Blue-and-yellow Macaw | B97: Ara ararauna | C97: 1 | F97: 1
A98: Red-and-green Macaw | B98: Ara chloroptera | C98: 1 | F98: 1
A99: Red-fronted Macaw | B99: Ara rubrogenys | C99: 1 | O99: 1
A100: Chestnut-fronted Macaw | B100: Ara severa | C100: 1 | F100: 1
A101: Blue-crowned Parakeet | B101: Aratinga acuticaudata | C101: 1 | D101: 1 | H101: 1 | O101: 1
A102: Mitred Parakeet | B102: Aratinga mitrata | C102: 1 | D102: 1 | O102: 1 | P102: 1 | Q102: 1 | R102: 1
A103: White-eyed Parakeet | B103: Aratinga leucophthalmus | C103: 1 | F103: 1
A104: Green-cheeked Parakeet | B104: Pyrrhura molinae | C104: 1 | Q104: 1 | R104: 1
A105: Cliff Parakeet | B105: Myiopsitta luchsi | C105: 1 | O105: 1
A106: Andean Parakeet | B106: Bolborhynchus orbygnesius | C106: 1 | H106: 1
A107: Gray-hooded Parakeet | B107: Psilopsiagon aymara | C107: 1 | I107: 1
A108: Mountain Parakeet | B108: Psilopsiagon aurifrons | C108: 1 | I108: 1 | U108: ssp margaritae
A109: Yellow-chevroned Parakeet | B109: Brotogeris chiriri | C109: 1 | D109: 1 | P109: 1 | Q109: 1
A110: White-bellied Parrot | B110: Pionites leucogaster | C110: 1 | F110: 1
A111: Blue-fronted Parrot | B111: Amazona aestiva | C111: 1 | D111: 1 | P111: 1 | Q111: 1
A112: Scaly-naped Parrot | B112: Amazona mercenaria | C112: 1 | P112: 1
A113: Mealy Parrot | B113: Amazona farinosa | C113: 1 | F113: 1
A114: Squirrel Cuckoo | B114: Piaya cayana | C114: 1 | D114: 1
A115: Greater Ani | B115: Crotophaga major | C115: 1 | F115: 1
A116: Smooth-billed Ani | B116: Crotophaga ani | C116: 1 | E116: 1 | F116: 1 | Q116: 1
A117: Guira Cuckoo | B117: Guira guira | C117: 1 | D117: 1 | E117: 1 | Q117: 1 | R117: 1
A118: Andean Pygmy-Owl | B118: Glaucidium jardinii | C118: 1 | K118: 1
A119: Burrowing Owl | B119: Athene cunicularia | C119: 1 | L119: 1 | U119: and Santa Cruz Viru-Viru airport
A120: Short-eared Owl | B120: Asio flammeus | C120: 1 | L120: 1
A121: Great Potoo | B121: Nyctibius grandis | C121: 1 | F121: 1
A122: Sand-colored Nighthawk | B122: Chordeiles rupestris | C122: 1 | F122: 1
A123: Common Pauraque | B123: Nyctidromus albicollis | C123: 1 | F123: 1
A124: Scissor-tailed Nightjar | B124: Hydropsalis torquata | C124: 1 | G124: 1 | H124: 1 | O124: 1
A125: White-collared Swift | B125: Streptoprocne zonaris | C125: 1 | D125: 1 | H125: 1
A126: White-tipped Swift | B126: Aeronautes montivagus | C126: 1 | D126: 1 | Q126: 1
A127: Planalto Hermit | B127: Phaethornis pretrei | C127: 1 | D127: 1
A128: Green Violet-ear | B128: Colibri thalassinus | C128: 1 | D128: 1
A129: Glittering-bellied Emerald | B129: Chlorostilbon aureoventris | C129: 1 | D129: 1 | H129: 1
A130: Gould's Inca | B130: Coeligena inca | C130: 1 | K130: 1 | U130: ssp torquata inca
A131: Sword-billed Hummingbird | B131: Ensifera ensifera | C131: ? | K131: ?
A132: Great Sapphirewing | B132: Pterophanes cyanopterus | C132: 1 | K132: 1
A133: Amethyst-throated Sunangel | B133: Heliangelus amethysticollis | C133: 1 | K133: 1
A134: Red-tailed Comet | B134: Sappho sparganura | C134: 1 | I134: 1 | O134: 1
A135: Tyrian Metaltail | B135: Metallura tyrianthina | C135: ? | K135: ?
A136: Scaled Metaltail | B136: Metallura aeneocauda | C136: ? | K136: ?
A137: Blue-mantled Thornbill | B137: Chalcostigma stanleyi | C137: 1 | K137: 1
A138: Collared Trogon | B138: Trogon collaris | C138: 1 | F138: 1
A139: Masked Trogon | B139: Trogon personatus | C139: 1 | T139: 1
A140: Blue-crowned Trogon | B140: Trogon curucui | C140: 1 | F140: 1
A141: Crested Quetzal | B141: Pharomachrus antisianus | C141: 1 | T141: 1
A142: Ringed Kingfisher | B142: Ceryle torquata | C142: 1 | F142: 1
A143: Amazon Kingfisher | B143: Chloroceryle amazona | C143: 1 | D143: 1 | F143: 1 | R143: 1
A144: Green Kingfisher | B144: Chloroceryle americana | C144: 1 | F144: 1
A145: American Pygmy Kingfisher | B145: Chloroceryle aenea | C145: 1 | F145: 1
A146: Blue-crowned Motmot | B146: Momotus momota | C146: 1 | F146: 1
A147: Spot-backed Puffbird | B147: Nystalus maculatus | C147: 1 | D147: 1 | P147: 1
A148: White-fronted Nunbird | B148: Monasa morphoeus | C148: 1 | F148: 1
A149: Blue-banded Toucanet | B149: Aulacorhynchus coeruleicinctis | C149: 1 | T149: 1
A150: Lettered Aracari | B150: Pteroglossus inscriptus | C150: 1 | F150: 1
A151: Chestnut-eared Aracari | B151: Pteroglossus castanotis | C151: 1 | Q151: 1
A152: Hooded Mountain-Toucan | B152: Andigena cucullata | C152: 1 | K152: 1
A153: Yellow-ridged Toucan | B153: Ramphastos culminatus | C153: 1 | F153: 1
A154: Yellow-tufted Woodpecker | B154: Melanerpes cruentatus | C154: 1 | F154: 1
A155: White-fronted Woodpecker | B155: Melanerpes cactorum | C155: 1 | H155: 1 | P155: 1
A156: Golden-breasted Woodpecker | B156: Colaptes melanolaimus | C156: 1 | H156: 1 | P156: 1
A157: Andean Flicker | B157: Colaptes rupicola | C157: 1 | L157: 1 | N157: 1
A158: Campo Flicker | B158: Colaptes campestris | C158: 1 | E158: 1 | U158: ssp campestris
A159: Red-necked Woodpecker | B159: Campephilus rubricollis | C159: 1 | P159: 1 | S159: 1 | T159: 1 | U159: ssp boliviana at Comarapa/Laguna Verde
A160: Crimson-crested Woodpecker | B160: Campephilus melanoleucos | C160: 1 | Q160: 1
A161: Common Miner | B161: Geositta cunicularia | C161: 1 | L161: 1
A162: Puna Miner | B162: Geositta punensis | C162: 1 | L162: 1
A163: Plain-breasted Earthcreeper | B163: Upucerthia jelskii | C163: 1 | K163: 1 | N163: ?
A164: Rock Earthcreeper | B164: Upucerthia andaecola | C164: 1 | N164: 1
A165: Bar-winged Cinclodes | B165: Cinclodes fuscus | C165: 1 | K165: 1 | N165: 1
A166: White-winged Cinclodes | B166: Cinclodes atacamensis | C166: 1 | I166: 1 | K166: 1
A167: Rufous Hornero | B167: Furnarius rufus | C167: 1 | D167: 1 | H167: 1 | I167: 1
A168: Brown-capped Tit-Spinetail | B168: Leptasthenura fuliginiceps | C168: 1 | I168: 1
A169: Wren-like Rushbird | B169: Phleocryptes melanops | C169: 1 | J169: 1
A170: Azara's Spinetail | B170: Synallaxis azarae | C170: 1 | I170: 1 | U170: ssp superciliata
A171: Stripe-crowned Spinetail | B171: Cranioleuca pyrrhophia | C171: 1 | H171: 1 | P171: 1
A172: Black-throated Thistletail | B172: Schizoeaca harterti | C172: 1 | K172: 1
A173: Creamy-breasted Canastero | B173: Asthenes dorbignyi | C173: 1 | I173: 1
A174: Pearled Treerunner | B174: Margarornis squamiger | C174: 1 | K174: 1 | T174: 1
A175: Plain Xenops | B175: Xenops minutus | C175: 1 | F175: 1
A176: Spix's Woodcreeper | B176: Xiphorhynchus spixii | C176: 1 | F176: 1
A177: Buff-throated Woodcreeper | B177: Xiphorhynchus guttatus | C177: 1 | F177: 1
A178: Narrow-billed Woodcreeper | B178: Lepidocolaptes angustirostris | C178: 1 | D178: 1 | H178: 1 | O178: 1
A179: Fasciated Antshrike | B179: Cymbilaimus lineatus | C179: 1 | F179: 1
A180: Variable Antshrike | B180: Thamnophilus caerulescens | C180: 1 | P180: 1 | S180: 1 | T180: 1 | U180: ssp boliviana?
A181: Rufous-capped Antshrike | B181: Thamnophilus ruficapillus | C181: 1 | I181: 1 | U181: ssp cochabambae
A182: Stripe-chested Antwren | B182: Myrmotherula longicauda | C182: ? | R182: ?
A183: Plumbeous Antbird | B183: Myrmeciza hyperythra | C183: 1 | F183: 1
A184: Rufous-capped Antthrush | B184: Formicarius colma | C184: 1 | F184: 1
A185: Zimmer's Tapaculo | B185: Scytalopus zimmeri | C185: 1 | K185: 1 | U185: ssp magellanicus zimmeri
A186: White-tipped Plantcutter | B186: Phytotoma rutila | C186: 1 | D186: 1 | H186: 1 | J186: 1
A187: Cinereous Mourner | B187: Laniocera hypopyrra | C187: 1 | F187: 1
A188: Red-crested Cotinga | B188: Ampelion rubrocristata | C188: 1 | G188: 1
A189: Band-tailed Fruiteater | B189: Pipreola intermedia | C189: 1 | K189: 1
A190: Barred Fruiteater | B190: Pipreola arcuata | C190: 1 | K190: 1
A191: Screaming Piha | B191: Lipaugus vociferans | C191: 1 | F191: 1
A192: Bare-necked Fruitcrow | B192: Gymnoderus foetidus | C192: 1 | F192: 1
A193: Blue-crowned Manakin | B193: Pipra coronata | C193: 1 | F193: 1
A194: Round-tailed Manakin | B194: Pipra chloromeros | C194: 1 | F194: 1
A195: Dwarf Tyrant-Manakin | B195: Tyranneutes stolzmanni | C195: 1 | F195: 1
A196: White-crested Elaenia | B196: Elaenia albiceps | C196: 1 | G196: 1
A197: White-throated Tyrannulet | B197: Mecocerculus leucophrys | C197: 1 | G197: 1
A198: Greater Wagtail-Tyrant | B198: Stigmatura budytoides | C198: 1 | H198: 1
A199: Yellow-billed Tit-Tyrant | B199: Anairetes flavirostris | C199: 1 | I199: 1 | P199: 1
A200: Many-colored Rush-Tyrant | B200: Tachuris rubrigastra | C200: 1 | J200: 1
A201: Rufous-tailed Flatbill | B201: Ramphotrigon ruficauda | C201: 1 | F201: 1
A202: White-throated Spadebill | B202: Platyrinchus mystaceus | C202: 1 | S202: 1
A203: Cinnamon Flycatcher | B203: Pyrrhomyias cinnamomea | C203: 1 | P203: 1 | T203: 1 | U203: Comarapa/Laguna Verde
A204: Cliff Flycatcher | B204: Hirundinea ferruginea | C204: 1 | D204: 1 | O204: 1 | P204: 1
A205: Euler's Flycatcher | B205: Lathrotriccus euleri | C205: 1 | H205: 1
A206: Crowned Chat-Tyrant | B206: Silvicultrix frontalis | C206: 1 | K206: 1
A207: Slaty-backed Chat-Tyrant | B207: Ochthoeca cinnamomeiventris | C207: 1 | K207: 1
A208: D'Orbigny's Chat-Tyrant | B208: Ochthoeca oenanthoides | C208: 1 | K208: 1
A209: Rufous-breasted Chat-Tyrant | B209: Ochthoeca rufipectoralis | C209: 1 | K209: 1
A210: Brown-backed Chat-Tyrant | B210: Ochthoeca fumicolor | C210: 1 | K210: 1
A211: Black-billed Shrike-Tyrant | B211: Agriornis montana | C211: 1 | O211: 1
A212: Puna Ground-Tyrant | B212: Muscisaxicola juninensis | C212: 1 | N212: 1
A213: Andean Negrito | B213: Lessonia oreas | C213: 1 | L213: 1
A214: White-winged Black-Tyrant | B214: Knipolegus aterrimus | C214: 1 | D214: 1 | I214: 1
A215: Yellow-browed Tyrant | B215: Satrapa icterophrys | C215: 1 | D215: 1
A216: Cattle Tyrant | B216: Machetornis rixosus | C216: 1 | E216: 1
A217: Brown-crested Flycatcher | B217: Myiarchus tyrannulus | C217: 1 | D217: 1
A218: Lesser Kiskadee | B218: Philohydor lictor | C218: 1 | F218: 1
A219: Great Kiskadee | B219: Pitangus sulphuratus | C219: 1 | I219: 1
A220: Boat-billed Flycatcher | B220: Megarynchus pitangua | C220: 1 | E220: 1
A221: Three-striped Flycatcher | B221: Conopias trivirgata | C221: 1 | H221: 1
A222: Streaked Flycatcher | B222: Myiodynastes maculatus | C222: 1 | H222: 1 | Q222: 1 | T222: 1
A223: Variegated Flycatcher | B223: Empidonomus varius | C223: 1 | H223: 1 | P223: 1 | R223: 1
A224: Crowned Slaty Flycatcher | B224: Griseotyrannus aurantioatrocristat | C224: 1 | H224: 1
A225: Tropical Kingbird | B225: Tyrannus melancholicus | C225: 1 | D225: 1 | F225: 1 | H225: 1 | O225: 1 | P225: 1 | Q225: 1 | R225: 1
A226: Eastern Kingbird | B226: Tyrannus tyrannus | C226: 1 | F226: 1
A227: Masked Tityra | B227: Tityra semifasciata | C227: 1 | F227: 1
A228: Brown-chested Martin | B228: Progne tapera | C228: 1 | E228: 1
A229: White-winged Swallow | B229: Tachycineta albiventer | C229: 1 | F229: 1
A230: Blue-and-white Swallow | B230: Pygochelidon cyanoleuca | C230: 1 | D230: 1 | J230: 1 | K230: 1
A231: Pale-footed Swallow | B231: Notiochelidon flavipes | C231: 1 | K231: 1
A232: White-banded Swallow | B232: Atticora fasciata | C232: 1 | F232: 1
A233: Southern Rough-winged Swallow | B233: Stelgidopteryx ruficollis | C233: 1 | F233: 1
A234: Barn Swallow | B234: Hirundo rustica | C234: 1 | E234: 1
A235: Fulvous Wren | B235: Cinnycerthia fulva | C235: 1 | L235: 1 | U235: ssp peruana fulva
A236: House Wren | B236: Troglodytes aedon | C236: 1 | D236: 1 | G236: 1 | H236: 1 | I236: 1 | O236: 1 | P236: 1 | Q236: 1 | R236: 1
A237: Mountain Wren | B237: Troglodytes solstitialis | C237: 1 | G237: 1 | S237: 1 | T237: 1 | U237: ssp frater
A238: Chalk-browed Mockingbird | B238: Mimus saturninus | C238: 1 | E238: 1
A239: Brown-backed Mockingbird | B239: Mimus dorsalis | C239: 1 | J239: 1 | N239: 1
A240: Swainson's Thrush | B240: Catharus ustulatus | C240: 1 | R240: 1
A241: Chiguanco Thrush | B241: Turdus chiguanco | C241: 1 | G241: 1 | I241: 1 | L241: 1 | N241: 1 | O241: 1
A242: Glossy-black Thrush | B242: Turdus serranus | C242: 1 | G242: 1
A243: Rufous-bellied Thrush | B243: Turdus rufiventris | C243: 1 | D243: 1 | H243: 1 | R243: 1
A244: Creamy-bellied Thrush | B244: Turdus amaurochalinus | C244: 1 | D244: 1 | H244: 1 | O244: 1
A245: Masked Gnatcatcher | B245: Polioptila dumicola | C245: 1 | D245: 1 | H245: 1 | O245: 1
A246: Purplish Jay | B246: Cyanocorax cyanomelas | C246: 1 | D246: 1 | F246: 1 | H246: 1 | Q246: 1 | R246: 1
A247: Plush-crested Jay | B247: Cyanocorax chrysops | C247: 1 | D247: 1 | Q247: 1
A248: White-collared Jay | B248: Cyanolyca viridicyana | C248: 1 | K248: 1
A249: House Sparrow | B249: Passer domesticus | C249: 1 | D249: 1 | E249: 1 | F249: 1 | N249: 1 | O249: 1
A250: Brown-capped Vireo | B250: Vireo leucophrys | C250: 1 | R250: 1
A251: Red-eyed Vireo | B251: Vireo olivaceus | C251: 1 | H251: 1
A252: Hooded Siskin | B252: Carduelis magellanica | C252: 1 | D252: 1 | H252: 1 | L252: 1 | P252: 1 | U252: ssp boliviana
A253: Masked Yellowthroat | B253: Geothlypis aequinoctialis | C253: 1 | D253: 1 | R253: 1
A254: Brown-capped Redstart | B254: Myioborus brunniceps | C254: 1 | I254: 1
A255: Spectacled Redstart | B255: Myioborus melanocephalus | C255: 1 | G255: 1 | K255: 1
A256: Citrine Warbler | B256: Basileuterus luteoviridis | C256: 1 | K256: 1 | S256: 1
A257: White-browed Conebill | B257: Conirostrum ferrugineiventre | C257: 1 | K257: 1
A258: Blue-backed Conebill | B258: Conirostrum sitticolor | C258: 1 | K258: 1
A259: Grass-green Tanager | B259: Chlorornis riefferii | C259: 1 | K259: 1
A260: Common Bush-Tanager | B260: Chlorospingus ophthalmicus | C260: 1 | G260: 1 | K260: 1
A261: Three-striped Hemispingus | B261: Hemispingus trifasciatus | C261: 1 | K261: 1
A262: Hepatic Tanager | B262: Piranga flava | C262: 1 | H262: 1 | P262: 1
A263: Silver-beaked Tanager | B263: Ramphocelus carbo | C263: 1 | F263: 1 | R263: 1
A264: Blue-gray Tanager | B264: Thraupis episcopus | C264: 1 | E264: 1 | F264: 1
A265: Sayaca Tanager | B265: Thraupis sayaca | C265: 1 | D265: 1 | G265: 1 | H265: 1 | I265: 1 | O265: 1 | Q265: 1 | R265: 1
A266: Blue-and-yellow Tanager | B266: Thraupis bonariensis | C266: 1 | D266: 1 | H266: 1 | I266: 1 | P266: 1
A267: Palm Tanager | B267: Thraupis palmarum | C267: 1 | F267: 1 | Q267: 1
A268: Hooded Mountain-Tanager | B268: Buthraupis montana | C268: 1 | K268: 1
A269: Scarlet-bellied Mountain-Tanager | B269: Anisognathus igniventris | C269: 1 | K269: 1
A270: Blue-winged Mountain-Tanager | B270: Anisognathus somptuosus | C270: 1 | G270: 1 | T270: 1 | U270: ssp flavinucus
A271: Purple-throated Euphonia | B271: Euphonia chlorotica | C271: 1 | H271: 1
A272: Straw-backed Tanager | B272: Tangara argyrofenges | C272: 1 | G272: 1 | U272: ssp boliviana
A273: Swallow-Tanager | B273: Tersina viridis | C273: 1 | R273: 1
A274: Red-crested Finch | B274: Coryphospingus cucullatus | C274: 1 | D274: 1 | H274: 1
A275: Black-hooded Sierra-Finch | B275: Phrygilus atriceps | C275: 1 | M275: 1
A276: Plumbeous Sierra-Finch | B276: Phrygilus unicolor | C276: 1 | K276: 1
A277: Ash-breasted Sierra-Finch | B277: Phrygilus plebejus | C277: 1 | N277: 1
A278: Black-crested Finch | B278: Lophospingus pusillus | C278: 1 | H278: 1
A279: Gray-crested Finch | B279: Lophospingus griseocristatus | C279: 1 | H279: 1
A280: Rufous-sided Warbling-Finch | B280: Poospiza hypochondria | C280: 1 | I280: 1
A281: Ringed Warbling-Finch | B281: Poospiza torquata | C281: 1 | D281: 1 | I281: 1 | N281: 1
A282: Black-capped Warbling-Finch | B282: Poospiza melanoleuca | C282: 1 | D282: 1 | H282: 1
A283: Blue-black Grassquit | B283: Volatinia jacarina | C283: 1 | H283: 1 | O283: 1
A284: Rusty-collared Seedeater | B284: Sporophila collaris | C284: 1 | E284: 1
A285: Double-collared Seedeater | B285: Sporophila caerulescens | C285: 1 | D285: 1 | O285: 1
A286: Band-tailed Seedeater | B286: Catamenia analis | C286: 1 | D286: 1 | I286: 1
A287: Moustached Flowerpiercer | B287: Diglossa mystacalis | C287: 1 | K287: 1 | U287: ssp unisincta
A288: Masked Flowerpiercer | B288: Diglossopis cyanea | C288: 1 | K288: 1
A289: Saffron Finch | B289: Sicalis flaveola | C289: 1 | D289: 1 | E289: 1 | H289: 1 | J289: 1 | O289: 1 | P289: 1 | Q289: 1 | R289: 1
A290: Bright-rumped Yellow-Finch | B290: Sicalis uropygialis | C290: 1 | L290: 1 | U290: ssp uropygialis
A291: Greenish Yellow-Finch | B291: Sicalis olivascens | C291: 1 | L291: 1
A292: Wedge-tailed Grass-Finch | B292: Emberizoides herbicola | C292: 1 | D292: 1
A293: Great Pampa-Finch | B293: Embernagra platensis | C293: 1 | O293: 1
A294: Red-crested Cardinal | B294: Paroaria coronata | C294: 1 | E294: 1
A295: Red-capped Cardinal | B295: Paroaria gularis | C295: 1 | F295: 1
A296: Rufous-naped Brush-Finch | B296: Atlapetes rufinucha | C296: 1 | G296: 1 | K296: 1 | S296: 1
A297: Fulvous-headed Brush-Finch | B297: Atlapetes fulviceps | C297: 1 | I297: 1
A298: Pectoral Sparrow | B298: Arremon taciturnus | C298: 1 | R298: 1
A299: Saffron-billed Sparrow | B299: Arremon flavirostris | C299: 1 | H299: 1
A300: Grassland Sparrow | B300: Ammodramus humeralis | C300: 1 | D300: 1
A301: Rufous-collared Sparrow | B301: Zonotrichia capensis | C301: 1 | D301: 1 | H301: 1 | I301: 1 | K301: 1 | L301: 1 | M301: 1 | N301: 1 | O301: 1 | P301: 1 | Q301: 1 | R301: 1
A302: Grayish Saltator | B302: Saltator coerulescens | C302: 1 | E302: 1
A303: Golden-billed Saltator | B303: Saltator aurantiirostris | C303: 1 | D303: 1 | I303: 1 | O303: 1 | P303: 1 | R303: 1
A304: Rufous-bellied Saltator | B304: Saltator rufiventris | C304: 1 | I304: 1
A305: Black-backed Grosbeak | B305: Pheucticus aureoventris | C305: 1 | H305: 1 | O305: 1 | P305: 1
A306: Ultramarine Grosbeak | B306: Cyanocompsa brissonii | C306: 1 | D306: 1 | H306: 1
A307: Yellow-winged Blackbird | B307: Agelaius thilius | C307: 1 | J307: 1
A308: Bay-winged Cowbird | B308: Molothrus badius | C308: 1 | E308: 1 | H308: 1 | J308: 1 | O308: 1 | P308: 1 | U308: ssp oriopsar badius
A309: Shiny Cowbird | B309: Molothrus bonariensis | C309: 1 | D309: 1 | H309: 1 | Q309: 1
A310: Giant Cowbird | B310: Scaphidura oryzivora | C310: 1 | F310: 1
A311: Red-rumped Cacique | B311: Cacicus haemorrhous | C311: 1 | F311: 1
A312: Crested Oropendola | B312: Psarocolius decumanus | C312: ? | Q312: ?
A313: Russet-backed Oropendola | B313: Psarocolius angustifrons | C313: 1 | F313: 1 | U313: Rurrenabaque
A314: Amazonian Oropendola | B314: Gymnostinops bifasciatus | C314: 1 | F314: 1 | U314: Chalalan
A315: Bolivian Blackbird | B315: Oreopsar bolivianus | C315: 1 | O315: 1
A317: 1343 SPECIES 19 ENDEMIC | C317: =SUM(C4:C316) -> 302 | D317: =SUM(D4:D315) -> 59 | E317: =SUM(E4:E315) -> 25 | F317: =SUM(F4:F315) -> 88 | G317: =SUM(G4:G315) -> 18 | H317: =SUM(H4:H315) -> 48 | I317: =SUM(I4:I315) -> 28 | J317: =SUM(J4:J315) -> 32 | K317: =SUM(K4:K315) -> 40 | L317: =SUM(L4:L315) -> 34 | M317: =SUM(M4:M315) -> 4 | N317: =SUM(N4:N315) -> 18 | O317: =SUM(O4:O315) -> 37 | P317: =SUM(P4:P315) -> 33 | Q317: =SUM(Q4:Q315) -> 31 | R317: =SUM(R4:R315) -> 22 | S317: =SUM(S4:S315) -> 8 | T317: =SUM(T4:T315) -> 13